Course,Department Name,Title,Pre Req
EN.675.771,PE Space Systems Engineering,Space Mission Design and Navigation,Completion of EN.675.600 Systems Engineering for Space; EN.675.601 Fundamentals of Engineering Space Systems I and EN.675.650 Mathematics for Space or with approval of the instructor.
EN.675.772,PE Space Systems Engineering,Verification and Validation of Space Systems,"EN.675.600 Systems Engineering for Space and EN.675.601 Fundamentals of Engineering Space Systems I, or with approval of the instructor"
EN.675.781,PE Space Systems Engineering,Physics of Space Security,EN.675.600 Systems Engineering for Space and EN.675.601 Fundamentals of Engineering Space Systems I
EN.675.792,PE Space Systems Engineering,Scientific Instruments for Space,
EN.675.800,PE Space Systems Engineering,Directed Studies in Space Systems Engineering,
EN.645.621,PE Systems Engineering,Engineering and Measuring Influence,
EN.645.631,PE Systems Engineering,Introduction to Model Based Systems Engineering,EN.645.662 Introduction to Systems Engineering OR EN.655.662 Introduction to Healthcare Systems Engineering
EN.645.632,PE Systems Engineering,Applied Analytics for Model Based Systems Engineering,EN.645.631 Introduction to Model Based Systems Engineering.
EN.645.650,PE Systems Engineering,Foundations of Human Systems Engineering,
EN.645.651,PE Systems Engineering,Integrating Humans and Technology,EN.645.662 Introduction to Systems Engineering OR EN.655.662 Introduction to Healthcare Systems Engineering OR EN.675.600 Systems Engineering for Space
EN.645.662,PE Systems Engineering,Introduction to Systems Engineering,
EN.645.667,PE Systems Engineering,Management of Systems Projects,
EN.645.669,PE Systems Engineering,Systems Engineering of Deployed Systems,EN.645.662 Introduction to Systems Engineering or EN.645.667 Management of Systems Projects. College-level Statistics (College-level Calculus preferred but not required).
EN.645.711,PE Systems Engineering,Systems Engineering of Missile Technologies,
EN.645.742,PE Systems Engineering,Management of Complex Systems,EN.645.769 System Test and Evaluation or EN.655.769 Healthcare System Test and Evaluation or advisor and instructor approval.
EN.645.753,PE Systems Engineering,Enterprise Systems Engineering,EN.645.769 System Test and Evaluation or advisor and instructor approval.
EN.645.755,PE Systems Engineering,Methods in Human-System Performance Measurement and Analysis,EN.645.662 Introduction to Systems Engineering OR EN.655.662 Introduction to Healthcare Systems Engineering.
EN.645.756,PE Systems Engineering,"Metrics, Modeling, and Simulation for Systems Engineering","EN.645.662 Introduction to Systems Engineering, EN.645.667 Management of Systems Projects, and EN.645.767 System Conceptual Design."
EN.645.757,PE Systems Engineering,Foundations of Modeling and Simulation in Systems Engineering,EN.645.662 Introduction to Systems Engineering OR EN.655.662 Introduction to Healthcare Systems Engineering.
EN.645.758,PE Systems Engineering,Advanced Systems Modeling and Simulation,EN.645.662 Introduction to Systems Engineering
EN.645.761,PE Systems Engineering,Systems Architecting,EN.645.769 System Test and Evaluation or advisor and instructor approval OR EN.655.769 Healthcare Systems Engineering Test and Evaluation or advisor and instructor approval.
EN.645.764,PE Systems Engineering,Software Systems Engineering,EN.645.662 Introduction to Systems Engineering or EN.655.662 Introduction to Healthcare Systems Engineering and EN.645.667 Management of Systems Projects or EN.655.667 Management of Healthcare Systems Projects or permission from the student’s academic advisor and the course instructor.
EN.645.766,PE Systems Engineering,Systems Engineering Advanced Technology,EN.645.768 System Design and Integration
EN.645.767,PE Systems Engineering,System Conceptual Design,EN.645.764 Software Systems Engineering or permission of the student’s advisor and the course instructor.
EN.645.768,PE Systems Engineering,System Design & Integration,EN.645.767 System Conceptual Design or permission of the student’s advisor and the instructor.
EN.645.769,PE Systems Engineering,System Test & Evaluation,EN.645.768 System Design and Integration or permission of the student’s advisor and the instructor.
EN.645.771,PE Systems Engineering,System of Systems Engineering,EN.645.769 System Test and Evaluation OR EN.655.769 Healthcare Systems Engineering Test and Evaluation or advisor and instructor approval.
EN.645.780,PE Systems Engineering,Agile Systems Engineering,EN.645.662 Introduction to Systems Engineering
EN.645.781,PE Systems Engineering,Systems Thinking and Systems Dynamics,EN.645.662 Introduction to Systems Engineering and EN.645.767 System Conceptual Design
EN.645.782,PE Systems Engineering,Foundations of Digital and Mission Engineering,EN.645.662 Introduction to Systems Engineering
EN.645.783,PE Systems Engineering,Systems Engineering Process Improvement,
EN.645.784,PE Systems Engineering,Decision Science & Analytics in Systems Engineering,
EN.645.800,PE Systems Engineering,Systems Engineering Master's Project,EN.645.769 System Test and Evaluation and an approved project concept from their project mentor and project instructor.
EN.645.801,PE Systems Engineering,Systems Engineering Master's Thesis,
EN.645.802,PE Systems Engineering,Systems Engineering Master's Thesis,
PH.700.600,PH Berman Institute,Basics of Bioethics,
PH.700.601,PH Berman Institute,Foundations of Bioethics,
PH.700.602,PH Berman Institute,Hot Topics in Bioethics,
PH.700.603,PH Berman Institute,Introduction to Ethical Theory,
PH.700.604,PH Berman Institute,Methods in Bioethics,
PH.700.605,PH Berman Institute,Critical Reasoning for Bioethics ,
PH.700.606,PH Berman Institute,Critical Reasoning for Bioethics II,
PH.700.621,PH Berman Institute,"Ethics in Clinical Practice: Fundamentals, Problems and Approaches",
PH.700.622,PH Berman Institute,"Bioethics, Human Rights, and Global Health",
PH.700.625,PH Berman Institute,Bioethics and the Law,
PH.700.630,PH Berman Institute,Food Ethics,
PH.700.632,PH Berman Institute,"Ethics, Policy, and Emerging Biomedical Technologies",
PH.700.641,PH Berman Institute,"Germs, Genes, Patients, and Populations",
PH.700.642,PH Berman Institute,Vulnerability in Childhood -- from Ethics to Advocacy,
PH.700.643,PH Berman Institute,"Understanding Addiction: Philosophy, Science, Ethics",
PH.700.644,PH Berman Institute,Justice Theory and Health,
PH.700.645,PH Berman Institute,Fogarty Bioethics Fellows Seminar,
PH.700.663,PH Berman Institute,Global Food Ethics and Policy,
PH.700.665,PH Berman Institute,Introduction to Ethics of U.S. and International Human Subject Research,
PH.700.667,PH Berman Institute,Catastrophe Ethics: How to Respond to Public Health Disasters,
PH.700.668,PH Berman Institute,Nutrition & Food Equity and Ethics,
PH.700.801,PH Berman Institute,Bioethics Program Thesis Seminar,
PH.700.820,PH Berman Institute,Bioethics Program Thesis Research,
PH.700.830,PH Berman Institute,Postdoctoral Research Berman Institute,
PH.700.840,PH Berman Institute,Bioethics Program Independent Study,
PH.700.895,PH Berman Institute,Bioethics Program Practicum,
PH.700.896,PH Berman Institute,Clinical Ethics Practicum I,
PH.700.897,PH Berman Institute,Clinical Ethics Practicum II,
PH.120.600,PH Biochemistry and Molecular Biology,Biochemistry I: Protein Structure and Enzyme Catalysis,
PH.120.601,PH Biochemistry and Molecular Biology,Biochemistry II: Major Metabolic Pathways,
PH.120.602,PH Biochemistry and Molecular Biology,Concepts of Molecular Biology,
PH.120.603,PH Biochemistry and Molecular Biology,Molecular Biology of Pandemic Influenza,
PH.120.604,PH Biochemistry and Molecular Biology,Introduction to Molecular Biology,
PH.120.605,PH Biochemistry and Molecular Biology,Genome Integrity,
PH.120.606,PH Biochemistry and Molecular Biology,Cellular Stress in Physiology and Disease,
PH.120.607,PH Biochemistry and Molecular Biology,Premedical Seminars: Planning and Preparing for Medical School Application,
PH.120.608,PH Biochemistry and Molecular Biology,"Gene Editing, Therapy and Manipulation",
PH.120.609,PH Biochemistry and Molecular Biology,Aspiring Physicians Enacting Change through Community Engagement: Introduction,
PH.120.610,PH Biochemistry and Molecular Biology,Biochemistry I: Protein Structure and Enzyme Catalysis,
PH.120.611,PH Biochemistry and Molecular Biology,Aspiring Physicians Enacting Change through Community Engagement,
PH.120.613,PH Biochemistry and Molecular Biology,Nucleic Acid Chemistry,
PH.120.616,PH Biochemistry and Molecular Biology,"Advanced Concepts in Biochemistry, Cell and Molecular Biology",
PH.120.620,PH Biochemistry and Molecular Biology,Fundamentals of Reproductive Biology,
PH.120.622,PH Biochemistry and Molecular Biology,Molecular and Cellular Mechanisms of Reproduction,
PH.120.624,PH Biochemistry and Molecular Biology,Cancer Biology,
PH.120.625,PH Biochemistry and Molecular Biology,Introduction to Cancer Biology,
PH.120.626,PH Biochemistry and Molecular Biology,Principles of Cell Biology,
PH.120.627,PH Biochemistry and Molecular Biology,Stem Cells and the Biology of Aging and Disease,
PH.120.630,PH Biochemistry and Molecular Biology,Fellowship Grant Writing for Students and Postdoctoral Fellows in Biomedical Research,
PH.120.644,PH Biochemistry and Molecular Biology,BMB SCM Laboratory Rotations,
PH.120.820,PH Biochemistry and Molecular Biology,Thesis Research Biochemistry,
PH.120.821,PH Biochemistry and Molecular Biology,BMB MHS Laboratory Research,
PH.120.822,PH Biochemistry and Molecular Biology,Seminars in Research in Biochemistry and Molecular Biology,
PH.120.825,PH Biochemistry and Molecular Biology,Advanced MHS Student Research,
PH.120.829,PH Biochemistry and Molecular Biology,Summer Thesis Research,
PH.120.830,PH Biochemistry and Molecular Biology,Postdoctoral Research Biochemistry,
PH.120.840,PH Biochemistry and Molecular Biology,Special Studies and Research Biochemistry,
PH.120.850,PH Biochemistry and Molecular Biology,Biochemical Techniques,
PH.120.852,PH Biochemistry and Molecular Biology,Core Research Literature,
PH.120.853,PH Biochemistry and Molecular Biology,Summer Biochemical Techniques,
PH.120.860,PH Biochemistry and Molecular Biology,Thesis Preparation,
PH.120.861,PH Biochemistry and Molecular Biology,Special Topics in Biochemistry: X-Ray Crystallography-A Hands on Workshop,
PH.120.870,PH Biochemistry and Molecular Biology,Thesis in Biochemistry and Molecular Biology,
PH.120.872,PH Biochemistry and Molecular Biology,Special Studies-Current Topics in BMB,
PH.140.604,PH Biostatistics,Introduction to R for Public Health Researchers,
PH.140.605,PH Biostatistics,Introduction to the SAS Statistical Package,
PH.140.606,PH Biostatistics,Survival Analysis,
PH.140.607,PH Biostatistics,Multilevel Models,
PH.140.608,PH Biostatistics,Analysis of Longitudinal Data,
PH.140.609,PH Biostatistics,Improving Precision and Power in Randomized Trials by Leveraging Baseline Variables,
PH.140.611,PH Biostatistics,Statistical Reasoning in Public Health I,
PH.140.612,PH Biostatistics,Statistical Reasoning in Public Health II,
PH.140.613,PH Biostatistics,Data Analysis Workshop I,
PH.140.614,PH Biostatistics,Data Analysis Workshop II,
PH.140.615,PH Biostatistics,Statistics for Laboratory Scientists I,
PH.140.616,PH Biostatistics,Statistics for Laboratory Scientists II,
PH.140.620,PH Biostatistics,Advanced Data Analysis Workshop,
PH.140.621,PH Biostatistics,Statistical Methods in Public Health I,
PH.140.622,PH Biostatistics,Statistical Methods in Public Health II,
PH.140.623,PH Biostatistics,Statistical Methods in Public Health III,
PH.140.624,PH Biostatistics,Statistical Methods in Public Health IV,
PH.140.628,PH Biostatistics,Data Science for Public Health I,
PH.140.629,PH Biostatistics,Data Science for Public Health II,
PH.140.630,PH Biostatistics,Introduction to Data Management,
PH.140.631,PH Biostatistics,The SAS Statistical Package: A Survey for Statisticians,
PH.140.632,PH Biostatistics,Introduction to the SAS Statistical Package,
PH.140.633,PH Biostatistics,Biostatistics in Medical Product Regulation,
PH.140.634,PH Biostatistics,Non-Inferiority and Equivalence Clinical Trials,
PH.140.636,PH Biostatistics,Scalable Computational Bioinformatics,
PH.140.638,PH Biostatistics,Analysis of Biological Sequences,
PH.140.640,PH Biostatistics,Statistical Methods for Sample Surveys,
PH.140.641,PH Biostatistics,Survival Analysis,
PH.140.642,PH Biostatistics,Design of Clinical Experiments,
PH.140.643,PH Biostatistics,Practice of Statistical Consulting,
PH.140.644,PH Biostatistics,"Statistical Machine Learning: Methods, Theory, and Applications",
PH.140.646,PH Biostatistics,Essentials of Probability and Statistical Inference I: Probability,
PH.140.647,PH Biostatistics,Essentials of Probability and Statistical Inference II: Statistical Inference,
PH.140.648,PH Biostatistics,Essentials of Probability and Statistical Inference III: Theory of Modern Statistical Methods,
PH.140.649,PH Biostatistics,Essentials of Probability and Statistical Inference IV,
PH.140.651,PH Biostatistics,Methods in Biostatistics I,
PH.140.652,PH Biostatistics,Methods in Biostatistics II,
PH.140.653,PH Biostatistics,Methods in Biostatistics III,
PH.140.654,PH Biostatistics,Methods in Biostatistics IV,
PH.140.655,PH Biostatistics,Analysis of Multilevel and Longitudinal Data,
PH.140.656,PH Biostatistics,Multilevel and Longitudinal Models - Data Analysis Workshop,
PH.140.658,PH Biostatistics,Statistics for Psychosocial Research: Structural Models,
PH.140.664,PH Biostatistics,Causal Inference in Medicine and Public Health I,
PH.140.665,PH Biostatistics,Causal Inference in Medicine and Public Health II,
PH.140.673,PH Biostatistics,INTRODUCTION TO STATISTICAL THEORY I,
PH.140.686,PH Biostatistics,Advanced Methods for Statistical Genetics and Genomics,
PH.140.688,PH Biostatistics,Statistics For Genomics,
PH.140.689,PH Biostatistics,Adaptive Enrichment Designs for Confirmatory Randomized Trials: Methods and Software,
PH.140.698,PH Biostatistics,Spatial Analysis III: Spatial Statistics,
PH.140.699,PH Biostatistics,Spatial Analysis IV: Spatial Design and Application,
PH.140.711,PH Biostatistics,Advanced Data Science I,
PH.140.712,PH Biostatistics,Advanced Data Science II,
PH.140.721,PH Biostatistics,Probability Theory I,
PH.140.722,PH Biostatistics,Probability Theory II,
PH.140.723,PH Biostatistics,Probability Theory III,
PH.140.724,PH Biostatistics,Probability Theory IV,
PH.140.731,PH Biostatistics,Statistical Theory I,
PH.140.732,PH Biostatistics,Statistical Theory II,
PH.140.733,PH Biostatistics,Statistical Theory III,
PH.140.734,PH Biostatistics,Statistical Theory IV,
PH.140.741,PH Biostatistics,Advanced Survival Analysis,
PH.140.742,PH Biostatistics,Risk Prediction and Precision Medicine,
PH.140.751,PH Biostatistics,Advanced Methods in Biostatistics I,
PH.140.752,PH Biostatistics,Advanced Methods in Biostatistics II,
PH.140.753,PH Biostatistics,Advanced Methods in Biostatistics III,
PH.140.754,PH Biostatistics,Advanced Methods in Biostatistics IV,
PH.140.762,PH Biostatistics,Bayesian Methods I,
PH.140.763,PH Biostatistics,Bayesian Methods II,
PH.140.772,PH Biostatistics,Advanced Statistical Theory,
PH.140.773,PH Biostatistics,Foundations of Statistical Inference,
PH.140.774,PH Biostatistics,Foundations of Statistics II,
PH.140.776,PH Biostatistics,Statistical Computing,
PH.140.777,PH Biostatistics, Statistical Programming Paradigms and Workflows,
PH.140.778,PH Biostatistics,"Statistical Computing, Algorithm, and Software Development",
PH.140.779,PH Biostatistics,Advanced Statistical Computing,
PH.140.800,PH Biostatistics,MPH Capstone Biostatistics,
PH.140.801,PH Biostatistics,Baltimore Community Data Science,
PH.140.802,PH Biostatistics,Baltimore Community Data Science II,
PH.140.820,PH Biostatistics,Thesis Research Biostatistics,
PH.140.830,PH Biostatistics,Postdoctoral Research Biostatistics,
PH.140.840,PH Biostatistics,Special Studies and Research Biostatistics,
PH.140.850,PH Biostatistics,Advanced Special Topics in Biostatistics,
PH.140.860,PH Biostatistics,Current Topics in Biostatistics Research,
PH.140.895,PH Biostatistics,MPH  Practicum: Biostatistics,
PH.140.921,PH Biostatistics,Biostats Lab for 140.621,
PH.140.922,PH Biostatistics,Lab for Biostats 140.622,
PH.140.923,PH Biostatistics,Lab for Biostats PH.140.623,
PH.140.924,PH Biostatistics,Lab for Biostatatistics 140.624,
PH.140.936,PH Biostatistics,Lab - Scalable Computational Bioinformatics,
PH.140.941,PH Biostatistics,Biostats Lab for 140.641,
PH.140.955,PH Biostatistics,Lab for Biostat 140.655,
PH.140.958,PH Biostatistics,Biostats Lab for 140.658,
PH.140.998,PH Biostatistics,Lab for PH.140.698,
PH.390.631,PH Clinical Investigation,Principles of Drug Development,
PH.390.673,PH Clinical Investigation,Ethical and Regulatory Issues in Clinical Research,
PH.390.675,PH Clinical Investigation,Outcomes and Effectiveness Research,
PH.390.677,PH Clinical Investigation,Database Design and Implementation in Clinical Research,
PH.390.678,PH Clinical Investigation,Introduction to Quality Improvement & Knowledge Translation Research,
PH.390.703,PH Clinical Investigation,Presentation Skills,
PH.390.710,PH Clinical Investigation,Biomedical Writing I,
PH.390.711,PH Clinical Investigation,Biomedical Writing II,
PH.390.721,PH Clinical Investigation,Principles of Grant Writing I,
PH.390.722,PH Clinical Investigation,Principles of Grant Writing II,
PH.390.750,PH Clinical Investigation,Introduction to Clinical Research,
PH.390.751,PH Clinical Investigation,Seminars in Clinical Investigation,
PH.390.752,PH Clinical Investigation,Seminars in Clinical Investigation II,
PH.390.801,PH Clinical Investigation,Professional Goals and Objectives,
PH.390.820,PH Clinical Investigation,Thesis Research in Clinical Investigation,
PH.390.840,PH Clinical Investigation,Special Studies and Research in Clinical Investigation,
PH.390.855,PH Clinical Investigation,Research Forum,
PH.180.600,PH Environmental Health and Engineering,Public Health Implications of Health as a Human Right,
PH.180.601,PH Environmental Health and Engineering,Environmental Health,
PH.180.602,PH Environmental Health and Engineering,Environment and Health in Low and Middle income Countries,
PH.180.605,PH Environmental Health and Engineering,Food Systems Practicum,
PH.180.606,PH Environmental Health and Engineering,Case Studies in Food Production and Public Health,
PH.180.607,PH Environmental Health and Engineering,Climate Change and Public Health,
PH.180.609,PH Environmental Health and Engineering,Principles of Environmental Health,
PH.180.610,PH Environmental Health and Engineering,Applied Environmental Health Practice,
PH.180.611,PH Environmental Health and Engineering,"The Global Environment, Climate Change, and Public Health",
PH.180.612,PH Environmental Health and Engineering,Advanced Environmental Health I,
PH.180.613,PH Environmental Health and Engineering,Teaching Environmental Health,
PH.180.614,PH Environmental Health and Engineering,Urban Agriculture and Public Health,
PH.180.618,PH Environmental Health and Engineering,"Law and Laboratory Animals: Statutes, Regulations and Policies",
PH.180.619,PH Environmental Health and Engineering,Drinking Water and Water Policy: Avoiding Another Flint,
PH.180.620,PH Environmental Health and Engineering,Introduction to Food Systems and Public Health,
PH.180.621,PH Environmental Health and Engineering,Protecting the Environment and Safeguarding Worker Health: A Problem-Based Approach,
PH.180.623,PH Environmental Health and Engineering,Infectious Disease Threats to Global Health Security,
PH.180.624,PH Environmental Health and Engineering,Biotechnology and Health Security,
PH.180.625,PH Environmental Health and Engineering,Community-Driven Epidemiology and Environmental Justice,
PH.180.626,PH Environmental Health and Engineering,Environmental Justice and Public Health Practice,
PH.180.627,PH Environmental Health and Engineering,Lessons Learned in 1918 Pandemic Flu,
PH.180.628,PH Environmental Health and Engineering,Introduction To Environmental and Occupational Health Law,
PH.180.630,PH Environmental Health and Engineering,"Chemical and Biological Weapons Threats: Science, Public Health, Policy",
PH.180.631,PH Environmental Health and Engineering,Environmental and Occupational Health Policy Seminar,
PH.180.632,PH Environmental Health and Engineering,Introduction to Molecular Toxicology,
PH.180.633,PH Environmental Health and Engineering,The Sociocultural Dimensions of Disasters,
PH.180.634,PH Environmental Health and Engineering,Public Health Emergencies: Risk Communication and Decision Science,
PH.180.635,PH Environmental Health and Engineering,"Seafood and Public Health: Global Trade, Nutrition and the Environment",
PH.180.636,PH Environmental Health and Engineering,Human Rights and Health Seminar,
PH.180.637,PH Environmental Health and Engineering,Refinement of Animal Experimentation: Essential to Reduce Animal Suffering and Enhance Scientific Rigor,
PH.180.638,PH Environmental Health and Engineering,Animals in Research: Ethics,
PH.180.639,PH Environmental Health and Engineering,Advanced Environmental Health II,
PH.180.640,PH Environmental Health and Engineering,Molecular Epidemiology and Biomarkers in Public Health,
PH.180.641,PH Environmental Health and Engineering,"Climate Change and Public Health Problem Solving Seminar: Global Challenges and Solutions for Mitigation, Adaptation, and Sustainability",
PH.180.644,PH Environmental Health and Engineering,Food System Resilience,
PH.180.647,PH Environmental Health and Engineering,The Health Effects of Indoor and Outdoor Air Pollution,
PH.180.650,PH Environmental Health and Engineering,Fundamentals of Clinical Oncology for Public Health Practitioners,
PH.180.651,PH Environmental Health and Engineering,"Energy, Environment, and Public Health",
PH.180.653,PH Environmental Health and Engineering,Climate Change: Avoiding Conflict and Improving Public Health,
PH.180.655,PH Environmental Health and Engineering,Baltimore Food Systems: A Case Study of Urban Food Environments,
PH.180.661,PH Environmental Health and Engineering,Writing Scientific Papers I,
PH.180.662,PH Environmental Health and Engineering,Writing Scientific Papers II,
PH.180.663,PH Environmental Health and Engineering,Grant Writing I,
PH.180.664,PH Environmental Health and Engineering,Grant Writing II,
PH.180.670,PH Environmental Health and Engineering,Introduction to Public Health Emergency Preparedness,
PH.180.820,PH Environmental Health and Engineering,EHE Doctoral Thesis Research,
PH.180.829,PH Environmental Health and Engineering,Summer Thesis Research,
PH.180.840,PH Environmental Health and Engineering,EHE Doctoral Special Studies and Research,
PH.180.841,PH Environmental Health and Engineering,SS/R: INTRODUCTION TO ENVIRONMENTAL HEALTH,
PH.180.860,PH Environmental Health and Engineering,EHE Student Seminar & Grand Rounds,
PH.181.845,PH Environmental Health and Engineering,MHS Special Studies & Research,
PH.181.850,PH Environmental Health and Engineering,MHS Essay  ,
PH.182.613,PH Environmental Health and Engineering,Exposure Assessment Techniques for Health Risk Management,
PH.182.614,PH Environmental Health and Engineering,Environmental and Occupational Monitoring,
PH.182.615,PH Environmental Health and Engineering,Airborne Particles,
PH.182.617,PH Environmental Health and Engineering,Exposure Sciences for Health Risk Assessment,
PH.182.621,PH Environmental Health and Engineering,Introduction to Ergonomics,
PH.182.622,PH Environmental Health and Engineering,Ventilation and Hazard Control,
PH.182.623,PH Environmental Health and Engineering,Occupational Health Management,
PH.182.625,PH Environmental Health and Engineering,Principles of Occupational and Environmental Hygiene,
PH.182.626,PH Environmental Health and Engineering,Issues for Water and Sanitation in Tropical Environmental Health,
PH.182.631,PH Environmental Health and Engineering,Principles of Occupational Safety,
PH.182.637,PH Environmental Health and Engineering,Noise and Other Physical Agents in the Environment,
PH.182.638,PH Environmental Health and Engineering,Environmental and Health Concerns in Water Use and Reuse,
PH.182.640,PH Environmental Health and Engineering,Food- and Water- Borne Diseases,
PH.182.641,PH Environmental Health and Engineering,"AIR, WATER AND FOOD TOXINS",
PH.182.810,PH Environmental Health and Engineering,MS Field Placement,
PH.182.845,PH Environmental Health and Engineering,EHE MS Special Studies and Research,
PH.182.850,PH Environmental Health and Engineering,EHE MS Essay,
PH.182.860,PH Environmental Health and Engineering,Special Studies Seminar in Occupational and Environmental Hygiene,
PH.183.631,PH Environmental Health and Engineering,Fundamentals of Human Physiology,
PH.183.638,PH Environmental Health and Engineering,Mechanisms of Cardiopulmonary Control,
PH.183.642,PH Environmental Health and Engineering,The Cardiopulmonary System Under Stress,
PH.183.643,PH Environmental Health and Engineering,Essentials of Pulmonary Function Measurements,
PH.183.825,PH Environmental Health and Engineering,EHE ScM Thesis Research,
PH.183.840,PH Environmental Health and Engineering,EHE Scm Special Studies and Research,
PH.184.830,PH Environmental Health and Engineering,Postdoctoral Research Environmental Health and Engineering,
PH.185.600,PH Environmental Health and Engineering,One Health Tools to Promote and Evaluate Healthy and Sustainable Communities,
PH.185.601,PH Environmental Health and Engineering,One Health Seminar,
PH.185.801,PH Environmental Health and Engineering,Exposure Sciences & Environmental Epi Journal Club,
PH.185.803,PH Environmental Health and Engineering,Health Security Journal Club,
PH.185.805,PH Environmental Health and Engineering,"Toxicology, Physiology & Molecular Mechanisms Journal Club & Seminar",
