Course,Department Name,Title,Pre Req
EN.601.664,EN Computer Science,Artificial Intelligence,
EN.601.665,EN Computer Science,Natural Language Processing,
EN.601.666,EN Computer Science,Information Retrieval and Web Agents,
EN.601.667,EN Computer Science,Introduction to Human Language Technology,
EN.601.668,EN Computer Science,Machine Translation,
EN.601.670,EN Computer Science,Artificial Agents,
EN.601.671,EN Computer Science,Natural Language Processing: Self-Supervised Models,((EN.601.464 OR EN.601.664) OR (EN.601.465 OR EN.601.665) OR (EN.601.467 OR EN.601.667) OR (EN.601.468 OR EN.601.668) OR (EN.601.475 OR EN.601.675))
EN.601.674,EN Computer Science,ML: Learning Theory,
EN.601.675,EN Computer Science,Machine Learning,
EN.601.676,EN Computer Science,Machine Learning: Data to Models,
EN.601.677,EN Computer Science,Causal Inference,
EN.601.682,EN Computer Science,Machine Learning: Deep Learning,
EN.601.684,EN Computer Science,ML: Interpretable Machine Learning Design,
EN.601.685,EN Computer Science,Probabilistic Models in the Visual Cortex,
EN.601.686,EN Computer Science,Machine Learning: Artificial Intelligence System Design & Development,(EN.601.475 OR EN.601.675) OR ( EN.601.464 OR EN.601.664) OR (EN.601.482 OR EN.601.682)
EN.601.690,EN Computer Science,Introduction to Human-Computer Interaction,
EN.601.691,EN Computer Science,Human-Robot Interaction,
EN.601.713,EN Computer Science,Future Networks,
EN.601.714,EN Computer Science,Advanced Computer Networks,
EN.601.717,EN Computer Science,Advanced Distributed Systems & Networks,
EN.601.718,EN Computer Science,Advanced Operating Systems,EN.600.318 OR EN.600.418 OR EN.601.318 OR EN.601.418 OR EN.601.618
EN.601.740,EN Computer Science,Language-based Security,
EN.601.741,EN Computer Science,Advanced Topics in Secure and Censorship-Resistant Communications,((EN.601.441 OR EN.601.641) OR (EN.601.442 OR EN.601.642) OR (EN.601.445 OR EN.601.645))
EN.601.742,EN Computer Science,Advanced Topics in Cryptography,EN.601.442 OR EN.601.642 or Permission of Instructor.
EN.601.743,EN Computer Science,Advanced Topics in Computer Security,
EN.601.745,EN Computer Science,Advanced Topics in Applied Cryptography,EN.600.454 OR EN.601.445 OR EN.601.645 OR EN.600.442 OR EN.601.442 OR EN.601.642
EN.601.749,EN Computer Science,Advanced Computational Genomics: Applied Comparative Genomics,
EN.601.760,EN Computer Science,FFT in Graphics & Vision,
EN.601.763,EN Computer Science,Advanced Topics in Robot Perception,
EN.601.764,EN Computer Science,Advanced NLP: Multilingual Methods,EN.601.465 OR EN.601.665
EN.601.769,EN Computer Science,Events Semantics in Theory and Practice,
EN.601.770,EN Computer Science,AI Ethics and Social Impact,
EN.601.771,EN Computer Science,"Self-Supervised Statistical Models: Opportunities, Challenges and Risks",
EN.601.778,EN Computer Science,Advanced Topics in Causal Inference,EN.601.477 OR EN.601.677
EN.601.779,EN Computer Science,Machine Learning: Advanced Topics,
EN.601.780,EN Computer Science,Unsupervised Learning: From Big Data to Low-Dimensional Representations,
EN.601.783,EN Computer Science,Vision as Bayesian Inference,
EN.601.787,EN Computer Science,Advanced Machine Learning: Machine Learning for Trustworthy AI,
EN.601.801,EN Computer Science,Computer Science Seminar,
EN.601.803,EN Computer Science,Masters Research,
EN.601.805,EN Computer Science,Graduate Independent Study,
EN.601.807,EN Computer Science,Teaching Practicum,
EN.601.808,EN Computer Science,Selected Topics in CS Education,
EN.601.809,EN Computer Science,PhD Research,
EN.601.810,EN Computer Science,Diversity and Inclusion in Computer Science and Engineering,
EN.601.814,EN Computer Science,Selected Topics in Computer Networks,
EN.601.817,EN Computer Science,Selected Topics in Systems Research,
EN.601.819,EN Computer Science,Selected Topics in Cloud Computing and Networked Systems,
EN.601.826,EN Computer Science,Selected Topics in Programming Languages,
EN.601.831,EN Computer Science,CS Theory Seminar,
EN.601.833,EN Computer Science,Seminar in Algorithms,
EN.601.845,EN Computer Science,Selected Topics in Applied Cryptography,
EN.601.849,EN Computer Science,Selected Topics in Computational Immunogenomics,
EN.601.856,EN Computer Science,Seminar: Medical Image Analysis,
EN.601.857,EN Computer Science,Selected Topics in Computer Graphics,
EN.601.862,EN Computer Science,Selected Topics in Medical Image Processing,
EN.601.864,EN Computer Science,Selected Topics in Multilingual Natural Language Processing,
EN.601.865,EN Computer Science,Selected Topics in Natural Language Processing,EN.601.465 OR EN.601.665.
EN.601.866,EN Computer Science,Selected Topics in Computational Semantics,
EN.601.868,EN Computer Science,Selected Topics in Machine Translation,
EN.700.791,EN Doctor of Engineering,Doctor of Engineering Fundamentals,
EN.700.792,EN Doctor of Engineering,Doctor of Engineering Research Proposal,
EN.700.891,EN Doctor of Engineering,Doctor of Engineering Research,
EN.520.123,EN Electrical & Computer Engineering,Computational Modeling for Electrical and Computer Engineering,
EN.520.137,EN Electrical & Computer Engineering,Introduction To Electrical & Computer Engineering,AS.110.106 OR AS.110.108
EN.520.142,EN Electrical & Computer Engineering,Digital Systems Fundamentals,
EN.520.150,EN Electrical & Computer Engineering,"Light, Image and Vision",
EN.520.151,EN Electrical & Computer Engineering,ECE Ideation and Design Lab (First Year),"Students must have completed Lab Safety training prior to registering for this class. To access the tutorial, login to myLearning and enter 458083 in the Search box to locate the appropriate module."
EN.520.211,EN Electrical & Computer Engineering,ECE Engineering Team Project,
EN.520.212,EN Electrical & Computer Engineering,ECE Engineering Team Project (Freshmen and Sophomores),
EN.520.214,EN Electrical & Computer Engineering,Signals and Systems,"(AS.110.107 OR AS.110.109);AS.110.202 or AS.110.211, prereq can be taken while taking EN.520.214"
EN.520.216,EN Electrical & Computer Engineering,Introduction To VLSI,(AS.110.107 OR AS.110.109) AND (AS.171.102 OR AS.171.104) AND EN.520.230 AND EN.520.231 AND EN.520.142
EN.520.219,EN Electrical & Computer Engineering,Introduction to Electromagnetics,AS.110.109 AND (AS.171.102 OR AS.171.104 OR AS.171.108) AND AS.173.112;AS.110.202
EN.520.220,EN Electrical & Computer Engineering,Electromagnetic Waves,EN.520.219
EN.520.225,EN Electrical & Computer Engineering,Advanced Digital Systems,EN.520.142
EN.520.230,EN Electrical & Computer Engineering,Mastering Electronics,(AS.110.107 OR AS.110.109) AND (AS.171.102 OR AS.171.108 OR AS.171.106) AND (AS.173.112 OR AS.173.116)
EN.520.231,EN Electrical & Computer Engineering,Mastering Electronics Laboratory,(AS.110.107 OR AS.110.109) AND (AS.171.102 OR AS.171.108) AND (AS.173.111 AND AS.173.112)
EN.520.232,EN Electrical & Computer Engineering,Mastering Electronics II,(AS.110.107 OR AS.110.109) AND (EN.500.112 OR EN.500.113 OR EN.500.114) AND (EN.520.230 AND EN.520.231)
EN.520.233,EN Electrical & Computer Engineering,Mastering Electronics II Lab,(AS.110.107 OR AS.110.109) AND (AS.171.102 OR AS.171.104 OR AS.171.108) AND (EN.500.112 OR EN.500.113 OR EN.500.114) AND (EN.520.230 AND EN.520.231)
EN.520.241,EN Electrical & Computer Engineering,"Introduction to Mechatronics: Sensing, Processing, Learning and Actuation",EN.520.230 AND EN.520.231
EN.520.250,EN Electrical & Computer Engineering,Leading Innovation Design Team,Students must have completed Lab Safety training prior to registering for this class.
EN.520.251,EN Electrical & Computer Engineering,ECE Ideation and Design Lab,Laboratory Safety Introductory Course available in MyLearning prior to registration. The course is accessible from the Education tab through the portal my.jh.edu. Please note that this requirement is not applicable to new students registering for their first semester at Hopkins.
EN.520.302,EN Electrical & Computer Engineering,Internet of Things Project Lab,"Students must have completed Lab Safety training prior to registering for this class. To access the tutorial, login to myLearning and enter 458083 in the Search box to locate the appropriate module."
EN.520.315,EN Electrical & Computer Engineering,Intro. to Bio-Inspired Processing of Audio-Visual Signals,
EN.520.344,EN Electrical & Computer Engineering,Introduction to Digital Signal Processing,EN.520.214 OR EN.580.242 OR EN.580.246
EN.520.349,EN Electrical & Computer Engineering,Microprocessor Lab I,"Students must have completed Lab Safety training prior to registering for this class. To access the tutorial, login to myLearning and enter 458083 in the Search box to locate the appropriate module."
EN.520.353,EN Electrical & Computer Engineering,Control Systems,EN.520.214 OR EN.530.343 OR (EN.580.243 AND EN.580.246)
EN.520.363,EN Electrical & Computer Engineering,ECE Ideation and Design Lab,"Students must have completed Lab Safety training prior to registering for this class. To access the tutorial, login to myLearning and enter 458083 in the Search box to locate the appropriate module."
EN.520.370,EN Electrical & Computer Engineering,Introduction to Renewable Energy Engineering,(AS.171.101 OR AS.171.105 OR AS.171.107 OR EN.530.123) AND (AS.110.109 OR AS.110.107)
EN.520.385,EN Electrical & Computer Engineering,"Signals, Systems, & Learning",(EN.580.243 AND (EN.580.246[C] OR EN.520.214)) AND (EN.553.310 OR EN.553.311) AND AS.110.201
EN.520.390,EN Electrical & Computer Engineering,Music Signal Processing,(EN.520.214 OR EN.580.246) AND (EN.500.113 OR EN.500.133);AS.110.201 OR EN.553.291 OR EN.553.310 OR EN.553.311 OR EN.553.420 OR EN.553.421 - student can either have already completed this class or must be concurrently registered at the same time as this course.
EN.520.403,EN Electrical & Computer Engineering,Introduction to Optical Instruments,AS.171.102 OR AS.171.108
EN.520.404,EN Electrical & Computer Engineering,"Engineering solutions in a global, economic, environmental, and societal context",
EN.520.407,EN Electrical & Computer Engineering,Introduction to the Physics of Electronic Devices,AS.171.102 OR AS.171.104 OR AS.171.108
EN.520.412,EN Electrical & Computer Engineering,Machine Learning for Signal Processing,(AS.110.201 AND EN.553.310 AND EN.520.344) OR (AS.110.201 AND EN.553.311 AND EN.520.344) OR (AS.110.201 AND EN.553.420 AND EN.520.344) OR (AS.110.201 AND EN.553.421 AND EN.520.344)
EN.520.414,EN Electrical & Computer Engineering,Image Processing & Analysis,EN.520.214 OR EN.580.222 OR EN.580.243
EN.520.415,EN Electrical & Computer Engineering,Image Process & Analysis II,EN.520.414
EN.520.417,EN Electrical & Computer Engineering,Computation for Engineers,(EN.553.291 OR EN.553.385 OR AS.110.201) AND (EN.520.214 OR EN.580.222 OR EN.580.243)
EN.520.418,EN Electrical & Computer Engineering,Modern Convex Optimization,(AS.110.201 OR AS.110.212 OR EN.553.291) AND (EN.500.113 OR EN.500.133 OR EN.540.382)
EN.520.420,EN Electrical & Computer Engineering,Bioelectricity from Neurons to Semiconductors,EN.520.230 AND EN.520.231
EN.520.424,EN Electrical & Computer Engineering,FPGA Synthesis Lab,EN.520.142 or equivalent.
EN.520.427,EN Electrical & Computer Engineering,Design of Advanced Instruments and Systems,"EN.520.231 Mastering Electronics or equivalent, or permission of instructor"
EN.520.432,EN Electrical & Computer Engineering,Medical Imaging Systems,EN.520.214 OR EN.580.222 OR (EN.580.243 AND EN.580.246)
EN.520.433,EN Electrical & Computer Engineering,Medical Image Analysis,EN.553.310 OR EN.553.311 OR EN.560.348 OR EN.553.420
EN.520.438,EN Electrical & Computer Engineering,Deep Learning,(EN.520.635 OR EN.520.344) AND (EN.520.412 OR EN.520.612 OR EN.601.220) AND (EN.553.420 OR EN.553.421 OR EN.553.310 OR EN.553.311) OR EN.601.220 OR permission of instructor.
EN.520.439,EN Electrical & Computer Engineering,Machine Learning for Medical Applications,(EN.520.412 OR EN.520.612 OR EN.553.740 OR EN.601.475 OR EN.553.636 OR EN.553.436) AND (EN.520.443 OR EN.580.472) AND (EN.520.635 OR EN.520.344) AND (EN.500.113 OR EN.500.133 OR EN.540.382)
EN.520.440,EN Electrical & Computer Engineering,Machine Intelligence on Embedded Systems,EN.520.412 OR EN.520.612 OR EN.601.475 OR EN.601.675 OR EN.601.676 OR EN.601.482 OR EN.601.682 OR EN.601.486 OR EN.601.686 OR EN.520.439 OR EN.520.659 OR EN.520.650
EN.520.445,EN Electrical & Computer Engineering,Audio Signal Processing,EN.520.344 AND EN.520.432
EN.520.447,EN Electrical & Computer Engineering,Information Theory,EN.553.310 OR EN.553.420 OR EN.553.421 OR EN.553.311
EN.520.448,EN Electrical & Computer Engineering,Electronics Design Lab,(EN.520.240 OR EN.520.340 OR EN.520.241 OR EN.520.230 OR EN.520.231) AND AS.110.109 AND (AS.171.102 OR AS.171.104) AND EN.520.142
EN.520.450,EN Electrical & Computer Engineering,Advanced Micro-Processor Lab,EN.520.349
EN.520.453,EN Electrical & Computer Engineering,Advanced ECE Engineering Team Project,"Students must have completed Lab Safety training prior to registering for this class. To access the tutorial, login to myLearning and enter 458083 in the Search box to locate the appropriate module."
EN.520.454,EN Electrical & Computer Engineering,Control Systems Design,(EN.553.291 OR EN.553.385 OR AS.110.201 or AS.110.212) AND EN.520.353
EN.520.457,EN Electrical & Computer Engineering,Quantum Mechanics for Engineering,
EN.520.462,EN Electrical & Computer Engineering,Leading Innovation Design Team,Students must have completed Lab Safety training prior to registering for this class.
EN.520.463,EN Electrical & Computer Engineering,ECE Ideation and Design Lab,Laboratory Safety Introductory Course available in MyLearning prior to registration. The course is accessible from the Education tab through the portal my.jh.edu. Please note that this requirement is not applicable to new students registering for their first semester at Hopkins.
EN.520.465,EN Electrical & Computer Engineering,Machine Perception,(AS.110.202 OR AS.110.212) AND (EN.553.291 OR EN.553.385 OR AS.110.201) AND (EN.553.310 OR EN.553.311 OR EN.553.420 OR EN.553.421) AND EN.520.385
EN.520.470,EN Electrical & Computer Engineering,Infra-Red Sensing & Technologies,
EN.520.482,EN Electrical & Computer Engineering,Introduction To Lasers,AS.171.102 OR AS.171.108
EN.520.483,EN Electrical & Computer Engineering,Bio-Photonics Laboratory,(AS.171.102 OR AS.171.108) AND AS.173.112 AND AS.110.202
EN.520.485,EN Electrical & Computer Engineering,Advanced Semiconductor Devices,
EN.520.486,EN Electrical & Computer Engineering,Physics of Semiconductor Electronic Devices,AS.171.102 OR AS.171.108
EN.520.487,EN Electrical & Computer Engineering,Clinical Diagnostic Devices and Methods,(EN.500.112 OR EN.500.113 OR EN.500.114) AND EN.520.230 AND EN.520.231
EN.520.491,EN Electrical & Computer Engineering,CAD Design of Digital VLSI Systems I (Juniors/Seniors),"Student may take EN.520.491 or EN.520.691, but not both.;AS.110.109 AND (AS.171.102 OR AS.171.104 OR AS.171.108) AND EN.520.142 AND EN.520.142 AND ( EN.520.230 OR ( EN.520.213 AND EN.520.345 OR EN.520.216 ) )"
EN.520.492,EN Electrical & Computer Engineering,Mixed-Mode VLSI Systems,EN.520.491
EN.520.495,EN Electrical & Computer Engineering,Microfabrication Laboratory,AS.171.102 OR AS.171.108
EN.520.497,EN Electrical & Computer Engineering,Data Communications and Networking,EN.520.214
EN.520.498,EN Electrical & Computer Engineering,Senior Design Project,(EN.553.291 OR EN.553.385 OR AS.110.201) AND (AS.110.202 OR AS.110.212) AND (AS.171.102 OR AS.171.108) AND EN.601.220 AND EN.520.142 AND EN.520.214 AND EN.520.230 AND EN.520.231
EN.520.504,EN Electrical & Computer Engineering,ECE Undergraduate Independent Study,"You must request Independent Academic Work using the Independent Academic Work form found in Student Self-Service: Registration, Online Forms."
EN.520.506,EN Electrical & Computer Engineering,ECE Undergraduate Research,"You must request Independent Academic Work using the Independent Academic Work form found in Student Self-Service: Registration, Online Forms."
EN.520.516,EN Electrical & Computer Engineering,ECE Group Undergraduate Research,"You must request Independent Academic Work using the Independent Academic Work form found in Student Self-Service: Registration, Online Forms."
EN.520.520,EN Electrical & Computer Engineering,Artificial Intelligence In Medicine Reading Group,"You must request Independent Academic Work using the Independent Academic Work form found in Student Self-Service: Registration, Online Forms.;EN.520.412 OR EN.520.612 OR EN.520.439"
EN.520.571,EN Electrical & Computer Engineering,Speech Technologies Reading Group,"You must request Independent Academic Work using the Independent Academic Work form found in Student Self-Service: Registration, Online Forms."
EN.520.575,EN Electrical & Computer Engineering,Intellectual Property Seminar for Engineering and Business Management,
EN.520.603,EN Electrical & Computer Engineering,Introduction to Optical Instruments,
EN.520.605,EN Electrical & Computer Engineering,Advanced Optical and Optoelectronic Instruments and Devices,
EN.520.607,EN Electrical & Computer Engineering,Introduction to the Physics of Electronic Devices,
EN.520.612,EN Electrical & Computer Engineering,Machine Learning for Signal Processing,
EN.520.613,EN Electrical & Computer Engineering,Advanced Topics in Optical Medical Imaging,
EN.520.614,EN Electrical & Computer Engineering,Image Processing & Analysis,
EN.520.615,EN Electrical & Computer Engineering,Image Processing & Analysis II,
EN.520.617,EN Electrical & Computer Engineering,Computation for Engineers,
EN.520.618,EN Electrical & Computer Engineering,Modern Convex Optimization,
EN.520.620,EN Electrical & Computer Engineering,Bioelectricity from Neurons to Semiconductors,
EN.520.621,EN Electrical & Computer Engineering,Introduction To Nonlinear Systems,
EN.520.622,EN Electrical & Computer Engineering,Principles of Complex Networked Systems,
EN.520.623,EN Electrical & Computer Engineering,Medical Image Analysis,EN.520.432 OR EN.580.472 AND EN.550.310 OR EN.550.311
EN.520.624,EN Electrical & Computer Engineering,Integrated Photonics,
EN.520.627,EN Electrical & Computer Engineering,Photovoltaics and Energy Devices,
EN.520.628,EN Electrical & Computer Engineering,Satellite Communication System,
EN.520.629,EN Electrical & Computer Engineering,Networked Dynamical Systems,
EN.520.631,EN Electrical & Computer Engineering,Ultrasound and Photoacoustic Beamforming,
EN.520.632,EN Electrical & Computer Engineering,Medical Imaging Systems,
EN.520.633,EN Electrical & Computer Engineering,Intro To Robust Control,
EN.520.635,EN Electrical & Computer Engineering,Digital Signal Processing,
EN.520.636,EN Electrical & Computer Engineering,Feedback Control in Biological Signaling Pathways,
EN.520.637,EN Electrical & Computer Engineering,Foundations of Reinforcement Learning,
EN.520.638,EN Electrical & Computer Engineering,Deep Learning,EN.520.435 OR EN.520.412 OR EN.520.612 or permission of instructor.
EN.520.639,EN Electrical & Computer Engineering,Communication Systems Engineering,
EN.520.640,EN Electrical & Computer Engineering,Machine Intelligence on Embedded Systems,EN.520.412 OR EN.520.612 OR EN.601.475 OR EN.601.675 OR EN.601.676 OR EN.601.482 OR EN.601.486 OR EN.520.439 OR EN.520.659 OR EN.520.650
EN.520.641,EN Electrical & Computer Engineering,Neuromorphic Circuits and Systems,EN.520.491 OR EN.520.691 OR EN.520.492 OR EN.520.692.
EN.520.643,EN Electrical & Computer Engineering,Low Power FPGA Hardware for Machine Learning,
EN.520.644,EN Electrical & Computer Engineering,FPGA Synthesis Lab,"Students must have completed Lab Safety training prior to registering for this class. To access the tutorial, login to myLearning and enter 458083 in the Search box to locate the appropriate module."
EN.520.645,EN Electrical & Computer Engineering,Audio Signal Processing,
EN.520.646,EN Electrical & Computer Engineering,Wavelets & Filter Banks,
EN.520.647,EN Electrical & Computer Engineering,Information Theory,
EN.520.648,EN Electrical & Computer Engineering,Compressed Sensing and Sparse Recovery,
EN.520.649,EN Electrical & Computer Engineering,Introduction to Radar Systems,
EN.520.650,EN Electrical & Computer Engineering,Machine Intelligence,
EN.520.651,EN Electrical & Computer Engineering,Random Signal Analysis,
EN.520.653,EN Electrical & Computer Engineering,Dynamics & Control of Modern Power Systems,
EN.520.654,EN Electrical & Computer Engineering,Control Systems Design,
EN.520.656,EN Electrical & Computer Engineering,Data Smoothing Using Machine Learning,
EN.520.657,EN Electrical & Computer Engineering,Design of Biomedical Instruments and Systems,
EN.520.659,EN Electrical & Computer Engineering,Machine learning for medical applications,EN.520.412 OR EN.520.612 OR EN.553.740 OR EN.601.475 OR EN.553.636 OR EN.553.436
EN.520.662,EN Electrical & Computer Engineering,Leading Innovation Design Team,
EN.520.663,EN Electrical & Computer Engineering,ECE Ideation and Design Lab,Laboratory Safety Introductory Course available in MyLearning prior to registration. The course is accessible from the Education tab through the portal my.jh.edu. Please note that this requirement is not applicable to new students registering for their first semester at Hopkins.
EN.520.665,EN Electrical & Computer Engineering,Machine Perception,
EN.520.666,EN Electrical & Computer Engineering,Information Extraction,
EN.520.680,EN Electrical & Computer Engineering,Speech and Auditory Processing by Humans and Machines,
EN.520.682,EN Electrical & Computer Engineering,Introduction to Lasers,
EN.520.683,EN Electrical & Computer Engineering,Bio-Photonics Laboratory,"Students must have completed Lab Safety training prior to registering for this class. To access the tutorial, login to myLearning and enter 458083 in the Search box to locate the appropriate module."
EN.520.685,EN Electrical & Computer Engineering,Advanced Semiconductor Devices,
EN.520.686,EN Electrical & Computer Engineering,Physics of Semiconductor Electronic Devices,
EN.520.687,EN Electrical & Computer Engineering,Clinical Diagnostic Devices and Methods,
EN.520.691,EN Electrical & Computer Engineering,CAD Design of Digital VLSI Systems I (Grad),
EN.520.692,EN Electrical & Computer Engineering,Mixed-Mode VLSI Systems,
EN.520.697,EN Electrical & Computer Engineering,Data Communications and Networking,
EN.520.698,EN Electrical & Computer Engineering,Networks Meet Machine Learning: Methods and Applications,
EN.520.738,EN Electrical & Computer Engineering,Advanced Electronic Lab Design,"Students must have completed Lab Safety training prior to registering for this class. To access the tutorial, login to myLearning and enter 458083 in the Search box to locate the appropriate module."
EN.520.773,EN Electrical & Computer Engineering,Advanced Topics In Microsytem Fabrication,"Students must have completed Lab Safety training prior to registering for this class. To access the tutorial, login to myLearning and enter 458083 in the Search box to locate the appropriate module."
EN.520.774,EN Electrical & Computer Engineering,Advanced Topics in Electrical and Computer Engineering,"Students must have completed Lab Safety training prior to registering for this class. To access the tutorial, login to myLearning and enter 458083 in the Search box to locate the appropriate module."
EN.520.800,EN Electrical & Computer Engineering,ECE Graduate Independent Study,
EN.520.802,EN Electrical & Computer Engineering,ECE Dissertation Research,
EN.520.803,EN Electrical & Computer Engineering,Graduate Summer Research,
EN.520.806,EN Electrical & Computer Engineering,ECE Master's Research,
EN.520.807,EN Electrical & Computer Engineering,Current Topics in Language and Speech Processing,
EN.520.820,EN Electrical & Computer Engineering,Artificial Intelligence In Medicine Reading Group,EN.520.612 OR EN.520.659 OR EN.520.439
EN.520.871,EN Electrical & Computer Engineering,Speech Technologies Reading Group,
EN.520.875,EN Electrical & Computer Engineering,Intellectual Property Seminar for Engineering and Business Management,
EN.520.890,EN Electrical & Computer Engineering,Independent Study-Summer,
EN.520.895,EN Electrical & Computer Engineering,Electrical & Computer Engineering Seminar,
EN.800.102,EN Engineering Precollege,Sustainable Energy Engineering,
EN.570.108,EN Environmental Health and Engineering,Introduction to Environmental Engineering and Design,
EN.570.110,EN Environmental Health and Engineering,Introduction to Engineering for Sustainable Development,
EN.570.201,EN Environmental Health and Engineering,Environmental Biology and Ecology,
EN.570.222,EN Environmental Health and Engineering,Environment and Society,
EN.570.239,EN Environmental Health and Engineering,Environmental Engineering Chemistry - Current and Emerging Topics,
EN.570.303,EN Environmental Health and Engineering,Environmental Engineering Principles and Applications,
EN.570.304,EN Environmental Health and Engineering,Environmental Engineering Laboratory,EN.570.303
EN.570.305,EN Environmental Health and Engineering,Environmental Health and Engineering Systems Design,
EN.570.320,EN Environmental Health and Engineering,Case Studies in Climate Change - A Field Course,
EN.570.321,EN Environmental Health and Engineering,Case Studies in Climate Change - A Field Course,EN.570.320
EN.570.334,EN Environmental Health and Engineering,Engineering Microeconomics,
EN.570.349,EN Environmental Health and Engineering,"Water quality of rivers, lakes, and estuaries",EN.570.303
EN.570.350,EN Environmental Health and Engineering,Environmental Hazards and Health Risks,(AS.171.101 ) AND (AS.030.101 AND AS.030.102) AND (AS.110.108 AND AS.110.109)
